{
  "admission": {
    "packet": "eligible",
    "query": "eligible",
    "reasons": [],
    "status": "admitted"
  },
  "attestation_digest": "c87742687df8e969d487bb2b4ba0334c33db287381ab65256f392ee20febbd73",
  "attestation_id": "att:google:knowledge-catalog:synthetic-table",
  "capability": {
    "attested": "metadata-only",
    "effective": "metadata-only",
    "requested": "metadata-only"
  },
  "checkpoint": {
    "digest": "6a922b3630f95cd221c0ee7ebfe96c3325e0363ba3e93f45958c35a82b3b11a1",
    "id": "ckpt:synthetic:knowledge-catalog-1",
    "revision_value": "entry-rev-1",
    "state": "current"
  },
  "cost": {
    "quota": "unavailable",
    "status": "unavailable"
  },
  "failures": [],
  "output": {
    "digest": "031813d8ed8536d8e4ed50f755fc14fc269ded8a55ff80ffc1779dbec2bee7a5",
    "envelope_path": null,
    "kind": "catalog-entry",
    "normalized": {
      "item_count": 1,
      "result_ids": [
        "entry:synthetic-dataset.synthetic-table"
      ]
    }
  },
  "permission": {
    "authorization_proof": false,
    "status": "attested"
  },
  "policy": {
    "classification": {
      "status": "evaluated",
      "value": "internal"
    },
    "dlp": {
      "findings": [],
      "status": "passed"
    },
    "public_boundary": {
      "outcome": "reject-export",
      "value": "internal"
    }
  },
  "product": {
    "component": "@bigquery",
    "identity": "google-knowledge-catalog",
    "name": "knowledge-catalog",
    "version": "1.0"
  },
  "profile": {
    "identity": "bran-google-enterprise-v1",
    "version": "1.0.0"
  },
  "runtime": {
    "network": "not-invoked"
  },
  "schema_version": "1.0.0",
  "source": {
    "configured_digest": "cd551de27ba354ea873214379619e3cb92b7b6d083f438be43d2781900fa7ec1",
    "filter_digest": "efc87ac927e47471ec0870f14a144f724af37afd1ad6199a7f54da960039a61a",
    "filters": {
      "asset_type": "bigquery-table",
      "entry_group": "@bigquery",
      "include_lineage": "references-only"
    },
    "locator": "projects/synthetic-project/locations/us/entryGroups/@bigquery/entries/synthetic-dataset.synthetic-table",
    "revision": {
      "kind": "entry",
      "state": "attested",
      "value": "entry-rev-1"
    }
  },
  "tenancy": {
    "account_ref": "acct:opaque:synthetic-001",
    "location": "us",
    "perimeter": "unavailable",
    "project": "synthetic-project",
    "tenant": "synthetic-tenant"
  },
  "truncation": {
    "omitted_bytes": 0,
    "omitted_item_count": 0,
    "reason": null,
    "truncated": false
  }
}
